{"item_id":"01ARZ3NDEKTSV4RRFFQ69G5FT0","title":"New ticket","type":"task","status":"open","project":"manyhands","team":"core","body":"Ticket body.\n","initials":"vh","deps":["01ARZ3NDEKTSV4RRFFQ69G5FR2","01ARZ3NDEKTSV4RRFFQ69G5FR1","01ARZ3NDEKTSV4RRFFQ69G5FR2"],"parent":"01ARZ3NDEKTSV4RRFFQ69G5FR1"}
